{
  "schema_version": "1.0",
  "device_id": "demo-pi",
  "session_id": "demo-session",
  "epoch": 1,
  "command_id": "alarm-demo",
  "event_id": "event-demo",
  "type": "alarm",
  "issued_at": "2026-09-24T00:00:00Z",
  "expires_at": "2026-09-24T00:00:10Z",
  "mode": "demo",
  "parameters": {
    "duration_ms": 1000,
    "led": true,
    "buzzer": true
  },
  "policy_version": "manual-review-only-v1"
}
